{
  "schema_version":"0.1","record_type":"CANDIDATE_DEFINITION","candidate_id":"fixture-candidate-b","version":"1.0.0","provider":"fixture-provider-b","model":"fixture-model-b","variant":"deterministic-mixed-profile","parameters":{"temperature":0,"stream":false},"status":"TEST_ONLY","source_class":"TEST_FIXTURE","created_at":"2099-08-01T00:00:00.000Z","metadata":{"synthetic":true,"real_capability_claim":false}
}
