{
  "schema_version":"0.1","record_type":"CANDIDATE_DEFINITION","candidate_id":"fixture-candidate-a","version":"1.0.0","provider":"fixture-provider-a","model":"fixture-model-a","variant":"deterministic-success-profile","parameters":{"temperature":0,"stream":false},"status":"TEST_ONLY","source_class":"TEST_FIXTURE","created_at":"2099-08-01T00:00:00.000Z","metadata":{"synthetic":true,"real_capability_claim":false}
}
